============================= test session starts =============================
platform win32 -- Python 3.12.4, pytest-7.4.2, pluggy-1.3.0
rootdir: C:\Users\DELL\Desktop\personal projects\Guardrails\guardrails
plugins: anyio-4.10.0, Faker-37.4.2
collected 194 items / 8 errors

=================================== ERRORS ====================================
______________ ERROR collecting tests/test_async_integration.py _______________
ImportError while importing test module 'C:\Users\DELL\Desktop\personal projects\Guardrails\guardrails\tests\test_async_integration.py'.
Hint: make sure your test modules/packages have valid Python names.
Traceback:
..\..\..\..\AppData\Local\Programs\Python\Python312\Lib\importlib\__init__.py:90: in import_module
    return _bootstrap._gcd_import(name[level:], package, level)
tests\test_async_integration.py:19: in <module>
    from app.main import app
app\main.py:7: in <module>
    from . import auth, logging, models
app\auth.py:5: in <module>
    from sqlalchemy.orm import Session
E   ModuleNotFoundError: No module named 'sqlalchemy'
_____________________ ERROR collecting tests/test_auth.py _____________________
ImportError while importing test module 'C:\Users\DELL\Desktop\personal projects\Guardrails\guardrails\tests\test_auth.py'.
Hint: make sure your test modules/packages have valid Python names.
Traceback:
..\..\..\..\AppData\Local\Programs\Python\Python312\Lib\importlib\__init__.py:90: in import_module
    return _bootstrap._gcd_import(name[level:], package, level)
tests\test_auth.py:3: in <module>
    from sqlalchemy import create_engine
E   ModuleNotFoundError: No module named 'sqlalchemy'
__________________ ERROR collecting tests/test_detection.py ___________________
ImportError while importing test module 'C:\Users\DELL\Desktop\personal projects\Guardrails\guardrails\tests\test_detection.py'.
Hint: make sure your test modules/packages have valid Python names.
Traceback:
..\..\..\..\AppData\Local\Programs\Python\Python312\Lib\importlib\__init__.py:90: in import_module
    return _bootstrap._gcd_import(name[level:], package, level)
tests\test_detection.py:3: in <module>
    from app.detection import detect_pii
app\detection.py:2: in <module>
    import spacy
E   ModuleNotFoundError: No module named 'spacy'
__________________ ERROR collecting tests/test_endpoints.py ___________________
ImportError while importing test module 'C:\Users\DELL\Desktop\personal projects\Guardrails\guardrails\tests\test_endpoints.py'.
Hint: make sure your test modules/packages have valid Python names.
Traceback:
..\..\..\..\AppData\Local\Programs\Python\Python312\Lib\importlib\__init__.py:90: in import_module
    return _bootstrap._gcd_import(name[level:], package, level)
tests\test_endpoints.py:3: in <module>
    from sqlalchemy import create_engine
E   ModuleNotFoundError: No module named 'sqlalchemy'
__________________ ERROR collecting tests/test_injection.py ___________________
ImportError while importing test module 'C:\Users\DELL\Desktop\personal projects\Guardrails\guardrails\tests\test_injection.py'.
Hint: make sure your test modules/packages have valid Python names.
Traceback:
..\..\..\..\AppData\Local\Programs\Python\Python312\Lib\importlib\__init__.py:90: in import_module
    return _bootstrap._gcd_import(name[level:], package, level)
tests\test_injection.py:2: in <module>
    from workers.detection import get_injection_score
workers\detection.py:1: in <module>
    from transformers import AutoTokenizer, AutoModelForSequenceClassification
E   ModuleNotFoundError: No module named 'transformers'
______________ ERROR collecting tests/test_token_integration.py _______________
ImportError while importing test module 'C:\Users\DELL\Desktop\personal projects\Guardrails\guardrails\tests\test_token_integration.py'.
Hint: make sure your test modules/packages have valid Python names.
Traceback:
..\..\..\..\AppData\Local\Programs\Python\Python312\Lib\importlib\__init__.py:90: in import_module
    return _bootstrap._gcd_import(name[level:], package, level)
tests\test_token_integration.py:17: in <module>
    from app.main import app
app\main.py:7: in <module>
    from . import auth, logging, models
app\auth.py:5: in <module>
    from sqlalchemy.orm import Session
E   ModuleNotFoundError: No module named 'sqlalchemy'
________________ ERROR collecting tests/test_token_tracking.py ________________
ImportError while importing test module 'C:\Users\DELL\Desktop\personal projects\Guardrails\guardrails\tests\test_token_tracking.py'.
Hint: make sure your test modules/packages have valid Python names.
Traceback:
..\..\..\..\AppData\Local\Programs\Python\Python312\Lib\importlib\__init__.py:90: in import_module
    return _bootstrap._gcd_import(name[level:], package, level)
tests\test_token_tracking.py:18: in <module>
    from app.token_tracking import (
app\token_tracking.py:21: in <module>
    import tiktoken
E   ModuleNotFoundError: No module named 'tiktoken'
_____________ ERROR collecting tests/test_webhook_integration.py ______________
ImportError while importing test module 'C:\Users\DELL\Desktop\personal projects\Guardrails\guardrails\tests\test_webhook_integration.py'.
Hint: make sure your test modules/packages have valid Python names.
Traceback:
..\..\..\..\AppData\Local\Programs\Python\Python312\Lib\importlib\__init__.py:90: in import_module
    return _bootstrap._gcd_import(name[level:], package, level)
tests\test_webhook_integration.py:15: in <module>
    from app.main import app
app\main.py:7: in <module>
    from . import auth, logging, models
app\auth.py:5: in <module>
    from sqlalchemy.orm import Session
E   ModuleNotFoundError: No module named 'sqlalchemy'
=========================== short test summary info ===========================
ERROR tests/test_async_integration.py
ERROR tests/test_auth.py
ERROR tests/test_detection.py
ERROR tests/test_endpoints.py
ERROR tests/test_injection.py
ERROR tests/test_token_integration.py
ERROR tests/test_token_tracking.py
ERROR tests/test_webhook_integration.py
!!!!!!!!!!!!!!!!!!! Interrupted: 8 errors during collection !!!!!!!!!!!!!!!!!!!
============================== 8 errors in 2.30s ==============================
